{
    "$schema": "http://json-schema.org/draft-07/schema#",
    "title": "Progression Schema",
    "description": "Schema for chord progression and key progression files in the Piano App. Supports both Roman numeral chord progressions (e.g., 'I IV V I') and key progressions with note names (e.g., 'C F Bb Eb').",
    "type": "object",
    "properties": {
        "version": {
            "type": "string",
            "description": "The schema version",
            "example": "1.0.0"
        },
        "id": {
            "type": "string",
            "description": "A unique identifier for the progression (UUID). Optional, can be generated if not provided.",
            "pattern": "^[0-9a-f]{8}-[0-9a-f]{4}-4[0-9a-f]{3}-[89ab][0-9a-f]{3}-[0-9a-f]{12}$"
        },
        "name": {
            "type": "string",
            "description": "Name of the progression",
            "maxLength": 100
        },
        "progression": {
            "type": "string",
            "description": "Progression string. Can be Roman numeral chord progressions (e.g., 'I IV V I', 'ii7 V7 I vi') or space-separated musical note names (e.g., 'C F Bb Eb').",
            "examples": [
                "I IV V I",
                "ii7 V7 I vi",
                "C F Bb Eb Ab Db Gb B E A D G"
            ]
        },
        "createdAt": {
            "type": "number",
            "description": "Creation timestamp in milliseconds. Optional, can be generated if not provided."
        },
        "metadata": {
            "type": "object",
            "properties": {
                "scaleType": {
                    "type": "string",
                    "description": "Target scale type for this progression (e.g., 'major', 'minor', 'natural_minor')"
                },
                "description": {
                    "type": "string",
                    "description": "Optional description of the progression"
                },
                "tags": {
                    "type": "array",
                    "description": "Optional array of tags for categorizing the progression",
                    "items": {
                        "type": "string"
                    },
                    "example": ["jazz", "classic", "sample"]
                },
                "key": {
                    "type": "string",
                    "description": "Root key for the progression (e.g., 'C', 'F#', 'Bb'). Used primarily for Roman numeral chord progressions."
                }
            },
            "additionalProperties": false
        }
    },
    "required": [
        "version",
        "name",
        "progression"
    ]
}