{
    "version": "1.0.0",
    "id": "b1b1b1b1-b1b1-4b1b-9b1b-b1b1b1b1b1b1",
    "name": "Blues Roots Master",
    "progression": "C F C C F F C C G F C G",
    "metadata": {
        "scaleType": "blues",
        "description": "Practice the blues scale through a 12-bar blues progression in C."
    },
    "createdAt": 1735230000000
}